Review,y_rasa,c_rasa,y_pelayanan,c_pelayanan,y_tempat,c_tempat,y_harga,c_harga
"Makanannya lumayan, tapi tempatnya ada bau tidak sedap jadi sedikit menganggu. Harganya agak mahal untuk kualitas segitu",0,1,0,0,-1,1,-1,1
"Suasananya membosankan dan kurang berkesan, tapi stafnya ramah. Lokasinya agak jauh dari pusat kota.",0,0,1,1,-1,1,0,0
"Harganya masuk akal, tapi kualitas makanannya biasa saja. Lokasinya agak berisik dan tidak ideal untuk makan malam yang tenang.",0,1,0,0,-1,1,0,1
"Pelayanan oke, tapi semoga bisa lebih cepat lagi. Tempatnya lumayan cukup luas tapi simpel.",0,0,0,1,0,1,0,0
Pelayanannya cukup baik dan harganya juga murah,0,0,0,1,0,0,1,1
Tempat makan cukup bagus buat tempat nongkrong. Harganya kurang terjangkau. pelayanannya semoga lain kali bisa lebih ditingkatkan.,0,0,0,1,0,1,-1,1
"Jam makan siang tidak terlalu ramai, menu seperti biasa standar. Lumayan kalau buat tempat nongkrong atau ngobrol",0,1,0,0,0,1,0,0
"So far so good, tapi coba untuk lebih banyak tempat yang dingin/berkipas/AC agar pelanggan lebih nyaman.  Pelayanan baik dan ramah",0,0,1,1,0,1,0,0
"Tempatnya lumayan strategis, parkiran luas. Namun sayang, karena parkirannya luas, suasana/ruang buat dine-in jadi sempit. Menunya sesuai standar pada umumnya",0,1,0,0,0,1,0,0
"menu dan makanan nya standar, untuk parkir agak susah apalagi di weekend. fasilitas standar nya minim. Harganya terlalu mahal",0,1,0,0,0,1,-1,1
Pelayanan yang diberikan cukup prima. Fasilitas yang diberikan standar  ,0,0,0,1,0,1,0,0
"Tempatnya kecil, tp nyaman. Makanan nya standar lah.",0,1,0,0,0,1,0,0
Standar pelayanannya. Untuk harganya terjangkau,0,0,0,1,0,0,1,1
"Super duper gak enak makanan nya, rasanya sangat asin. Menurut saya kalo dari segi harga sangat tidak sesuai. Pelayanannya so far cukup bagus tapi semoga bisa lebih baik",-1,1,0,1,0,0,-1,1
"Parkir luas, untuk menu dan rasa sama dan standar. Harganya tergolong standar",0,1,0,0,1,1,0,1
"Biasa aja ya pelayanannya, tidak ada yang istimewa. Tidak jelek dan tidak spesial. Sesuai standar",0,0,0,1,0,0,0,0
"Strategi harganya kurang nyaman. Agak mahal kecuali anda mau beli CD lagu-lagunya.
Tempatnya cukup enak",0,0,0,0,0,1,0,1
"Tempat ok, pelayanan ok, harga affordable, pilihan menu cukup bervariasi",0,0,0,1,0,1,1,1
"Tempat kecil..
Pelayanan oke..",0,0,0,1,-1,1,0,0
"pelayanan cepat dan ramah, bisa untuk merayakan even ulang tahun dg harga terjangkau",0,0,1,1,0,0,1,1
Lama ngk ada persiapan sama sekali pelayanan jelek. Harganya juga makin mahal,0,0,-1,1,0,0,-1,1
Tempat lumayan ok buat hangout. Pelayanannya lumayan cepat. Tapi harganya mahal banget!,0,0,0,1,0,1,-1,1
Makanannya kurang sesuai sama gambar dan sangat sedikit porsinya untuk harga yang terbilang sangat mahal. rasa makannya juga menurutku gak nikmat,-1,1,0,0,0,0,-1,1
"Responsif pelayanan cepat, tapi sayang tempat parkir sempit jadi susah memarkir kendaraan",0,0,1,1,-1,1,0,0
Pelayanan yang ramah dan cepat. Tempat kurang bersih sehingga kurang nyaman,0,0,1,1,-1,1,0,0
"Rasa masakannya, ya standard. Kafenya lumayan nyaman. Yang terpenting harganya sangat bersahabat",0,1,0,0,0,1,1,1
"Rasanya masakannya pas... pelayannya cukup ramah
Parkirannya dan tempatnya aja yg kecil...",0,1,0,1,-1,1,0,0
"Lokasinya kurang strategis, tapi kapasitas parkirnya luas. Harganya sesuai sama kualitas. Pelayanannya baik.",0,0,1,1,0,1,0,1
"Tempat ok. Staffnya lumayan ramah. Untuk harga relatif terjangkau, rasa cukup tapi perlu ditingkatkan.",0,1,0,1,0,1,0,1
"Untuk makanan kurang recomended terutama porsi dan rasa yang ga worth it dengan harga nya, untuk kopi not bad lah",-1,1,0,0,0,0,-1,1
"harga terjangkau, karyawan dan owner juga ramah dan sangat menghargai pelanggan",0,0,1,1,0,0,1,1
"Tempatnya lumayan nyaman. Akan lebih menyenangkan bila pelayanan lebih ditingkatkan, dengan sambutan lebih ramah & ceria. Harganya juga cukup terjangkau",0,0,0,1,0,1,0,1
Tempat lumayan buat ngopi plus kerja. Rasa oke. Harga affordable.,0,1,0,0,0,1,1,1
"Waiter melayani dengan senyum, lumayan menyenangkan. Tempatnya juga cukup nyaman",0,0,0,1,0,1,0,0
"Pelayanan cukup memadai, tapi bisa lebih baik. Makanannya cukup enak, tapi seperti ada yang kurang. Harganya standar tidak mahal dan tidak murah",0,1,0,1,0,0,0,1
"Pelayannya sangat ramah, bersedia membantu dan menjelaskan terkait pesanan dengan detail. Tempat makannya cukup bersih dan luas, hanya saja tempat cuci tangan terasa kurang nyaman. ",0,0,1,1,0,1,0,0
"walaupun selalu naik harganya tapi masih cukup terjangkau. Pelayanannya juga tidak perlu diragukan lagi, selalu terbaik",0,0,1,1,0,0,0,1
"Makanannya ga enak, tempatnya juga ada bau-bau tidak sedap. Pelayanannya ya standar aja ",-1,1,0,1,-1,1,0,0
"Untuk tempat, menurut saya lumayan buat ngobrol santai bareng temen. Untuk harga menu standar seperti kafe pada umumnya, untuk minuman non kopinya 20k. Pelayanan cepat, pegawai ramah.",0,0,1,1,0,1,0,1
Rasanya kurang. Tersedia koneksi internet gratis walau kualitasnya gak terlalu bagus. Harganya juga murah karna banyak diskon dan cashback yang bisa ditukarkan,0,1,0,0,0,1,1,1
"Interiornya lumayan buat ngobrol sama temen. harga kopinya juga gak mahal. buat rasa makanan standar sih, not that special.",0,0,0,0,0,1,1,1
Kasirnya ramah banget. Tapi karena tempatnya di pinggir jalan jadi ga cocok buat bawa anak. Berisik buangeeettt,0,0,1,1,-1,1,0,0
Rasanya kurang konsisten. Tapi harganya selalu murah apalagi banyak diskonnya. Pelayanannya cukup cepat,0,1,0,1,0,0,1,1
"Bumbu nggak meresap, cuma rasa asin doang. Pelayanannya cukup memuaskanlah",-1,1,0,1,0,0,0,0
Rasanya lumayan tapi ayamnya rada amis. Tapi setiap kali makan di sini puas sama pelayanannya yang konsisten bagus. Harganya yang kurang pas dikantong,0,1,1,1,0,0,-1,1
Tempatnya engga terlalu besar tapi pelayanannya cukup baik dan harganya juga bersahabat,0,0,0,1,0,1,1,1
Harga bersahabat dan rasanya oke. Disini akan sangat ramai tempatnya jika akhir pekan. Pelayanannya cukup baik,0,1,0,1,0,1,1,1
"Rasa menu biasa saja. Harga yang diberikan menurut saya overprice, apalagi ketika dibandingkan dengan rasa yang disajikan. Pelayanannya juga ga ada yang special",0,1,0,1,0,0,-1,1
"Nyaman, pelayanan ramah. Petugas sibuk membersihkan meja kursi sebaik baik nya",0,0,1,1,1,1,0,0
Lumayan lah suasananya tidak terlalu ramai. Tapi untuk pelayanannya standar si. Harganya sangat murah,0,0,0,1,0,1,1,1
"Tempat makannya lumayan lah, tidak terlalu luas tapi pas. harganya juga lumayan",0,0,0,0,0,1,0,1
"Tempatnya bagus tapi kursinya kurang nyaman, makanannya lumayan enak, untuk harga cukup terjangkau",0,1,0,0,0,1,0,1
"Kuahnya gak enak dan kemanisan padahal pesan yang pedas. Harganya kurang ramah dikantong. Tapi pelayanannya top, ramah dan sopan",-1,1,1,1,0,0,-1,1
Nyaman tapi terlalu ramai tempatnya kalau untuk ngobrol. Minuman dan makanan harganya standar,0,0,0,0,0,1,0,1
Dari segi makanan relatif enak namun terakhir saya pesan burger isian sayurannya asem bgt jadi kurang menikmati. Tempatnya cukup luas dan pelayanan cukup baik,0,1,0,1,0,1,0,0
"Untuk ice coffe di sini kenapa kebanyakan susu sama es batu yaa, sumpah jadi gak berasa kopi sama gula , jadi cuma kaya air putih pake es. Tapi untuk harganya memang sangat terjangkau",-1,1,0,0,0,0,1,1
Pelayanan staff yang baik dan sopan. Dengan menggunakan aplikasi MCD kita bisa mendapatkan potongan harga dan lebih mudah untuk order hanya dengan scan barcode yang sudah ada di aplikasi untuk order dan dilanjutkan payment,0,0,1,1,0,0,1,1
"Pelayanan baik dan pegawai sangat ramah. Tempat cukup nyaman dan luas, hanya saja wifi saat itu mati. Untuk harganya murah dan terjangkau",0,0,1,1,0,1,1,1
petugasnya sabar dan ramah juga bs mengarahkan menu sesuai kebutuhan customer jg gak pelit info... pas saat pembayaran petugas lainnya jg kooperatif banget. Harganya ekonomis,0,0,1,1,0,0,1,1
Tempatnya tidak terjaga(sampah yang bau dan wastafel habis sabun) . Semoga karyawannya bisa ditambah lagi dan pelayanannya ditingkatkan,0,0,0,1,-1,1,0,0
Tempatnya sempit. Antar meja sangat pendek. Kebersihan masih kurang. Tapi untuk harga pas dikantong,0,0,0,0,-1,1,1,1
Layanan antarnya lumayan cepat dengan harga yang ga bikin dompet jebol,0,0,0,1,0,0,1,1
"Rasanya standar si ga ada yang special tapi harganya itu loh murah banget, banyaak diskon dan voucher yang bisa ditukar.  Pelayanannya si biasa aja si lumayan oke",0,1,0,1,0,0,1,1
"Harga & promonya mantap banget di sini. Pelayanannya cukup ramah, tempatnya kurang luas untuk makan ditempat jadi agak sempit. ",0,0,0,1,-1,1,1,1
"makanan dengan harga relatif murah, tapi tempat terlalu sempit dan sumpek saat weekend. Pelayanannya standar tolong tingkatkan lagi",0,0,0,1,-1,1,1,1
"Harganya standar cafe,  makanannya juga standar sih. Asik buat kumpul",0,1,0,0,0,0,0,1
"Tempat makannya gak terlalu luas tapi tetep nyaman, untuk makanan harganya gak terlalu mahal",0,0,0,0,0,1,0,1
Harganya worth it. Rasa saus padangnya enak tapi agak encer jadinya agak rawan luber. Pelayanannya lumayan memuaskan,0,1,0,1,0,0,1,1
"Tempatnya lumayan buat nongkrong soalnya ada live music. Menurut aku makanannya murah-murah, tapi kuantitas dan rasa kurang oke.",-1,1,0,0,0,1,1,1
"Ayamnya kadang dagingnya hitam, trus keras . Tempatnya juga kurang bersih",-1,1,0,0,-1,1,0,0
Jangan lupa pake aplikasi mcd. Ada promo yang bisa kita beli dengan harga lebih murah. Pelayanannya lumayan oke ,0,0,0,1,0,0,1,1
"Pelayan nya helpfull bisa pilih menu sendiri di mesin , atau di layani di kasir. Makanannya juga murah-murah",0,0,1,1,0,0,1,1
Saking ramenya tempat sampai gak dapet kursi. Untuk menu minuman terbilang agak mahal dengan banyak porsi yang disajikan.,0,0,0,0,0,1,-1,1
"Pelayanan lumayan lah, harga makanan dan minuman terjangkau",0,0,0,1,0,0,1,1
Untuk harga menengah lah yaa. Soal rasa boleh lah dicoba. Pelayanan standar,0,1,0,1,0,0,0,1
Untuk harga makanan dan minuman cukup terjangkau harganya. Sedikit saran agar lebih diperluas space antar meja nya agar tempat tidak terkesan sempit. Pelayanannya lumayan bagus tapi semoga lebih baik,0,0,0,1,0,1,0,1
"rasa kurang cocok sih, just so so but ya sesuai harga kali yak",-1,1,0,0,0,0,0,1
"tempat agak kecil tapi suasana sejuk, harga menengah ke atas",0,0,0,0,0,1,-1,1
"Harga lumayan, rasa menu lumayan. Tempat perlu diperbaiki supaya tidak terkesan lembab terutama dindingnya",0,1,0,0,0,1,0,1
"Rasanya lumayan oke, tapi sayang tempatnya berisik anak kecik pada teriak.. agak menganggu..",0,1,0,0,-1,1,0,0
Rasanya parah sekelas restoran ga worth it banget. Padahal harganya udah tergolong mahal tapi rasanya zonk. Pelayanannya standar,-1,1,0,0,1,0,-1,1
"Petugasnya ramah dan cepat dalam bekerja, tapi sayang tempatnya kurang bersih dan kurang rapi. Harganya sulit untuk dijangkau kalangan menengah ke bawah",0,0,1,1,-1,1,-1,1
"pelayanan sangat ramah, karena pemesanan yang dilakukan secara mandiri lewat komputer pemesanan dipandu dengan baik oleh pelayan di sana. Tidak hanya itu, saya diberikan penawaran promo yang menarik juga, sungguh pengalaman yang menyenangkan,",0,0,1,1,0,0,1,1
"Menu rasanya biasa, tapi harga luar biasa mahalnya",0,1,0,0,0,0,-1,1
"Tempatnya lumayan untuk nongkrong, harga makanannya jg terjangkau",0,0,0,0,0,1,1,1
"Rasanya biasa aja, pelayanannya cukup ramah. Harga cukup terjangkau",0,1,0,1,0,0,0,1
"Makanannya hambar seperti kurang bumbu, tapi pelayannya cukup membantu dan harganya juga murah ",-1,1,0,1,0,0,1,1
"Saya kecewa dengan rasa masakannya, tapi tempatnya cukup bersih.",-1,1,0,0,0,1,0,0
Rasanya standar banget tapi harganya terlalu mahal  ga worth it,0,1,0,0,0,0,-1,1
Makanannya standar dengan harga yang sesuai,0,1,0,0,0,0,0,1
Makanannya lumayan dan harganya sangat murah,0,1,0,0,0,0,1,1
"Makanannya tidak terlalu berkesan, pelayanannya juga biasa saja. Harga makanannya sulit terjangkau",0,1,0,1,0,0,-1,1
"Makanannya terlalu asin dan tempatnya kurang bersih, membuat saya kurang nyaman",-1,1,0,0,-1,1,0,0
"Porsi makanannya cukup mengenyangkan, dan harganya sangat terjangkau. Pelayannya cukup baik menjalankan tugasnya",0,1,0,1,0,0,1,1
"Dagingnya terlalu alot, pelayanannya biasa saja",-1,1,0,1,0,0,0,0
"Menu yang ditawarkan cukup standar, namun harganya tergolong mahal",0,1,0,0,0,0,1,1
"Makanannya kurang berasa, pelayannya pun tidak terlalu membantu. Harganya tergolong mahal",-1,1,0,1,0,0,-1,1
"Pelayan lumayan slow respon, Harga makanannya menurut saya kemahalan",0,0,0,1,0,0,-1,1
Harga merakyat tapi wajar sih karena rasanya juga biasa-biasa aja,0,1,0,0,0,0,1,1
rasa makanan standar. Ruangannya lumayan besar tapi sepertinya kurang terawat. Harganya relatif,0,1,0,0,0,1,0,1
"Untuk rasa makanannya kurang enak semua, harganya terlalu mahal, air putih segelas pun 15rb/gelas",-1,1,0,0,0,0,-1,1
"Harganya lumayan mahal untuk kantong mahasiswa, apalagi dengan rasa yang tidak terlalu menggoda lidahku",0,1,0,0,0,0,0,1
Staf tidak terlalu profesional. kualitas rasanya oke namun tidak luar biasa,0,1,0,1,0,0,0,0
"makanannya biasa aja ga begitu wow, tapi untuk menu cukup bervarian sih. Untuk harga cukup terjangkau. pelayanannya lumayan ga sigap tapi wajar karena pelayannya sedikit",0,1,0,1,0,0,0,1
Tempatnya sesuai lah sama tema. Harga mahal banget ya hehe,0,0,0,0,0,1,-1,1
"Tempat OK, namun sepertinya kurang luas. Dan untuk harganya kurang terjangkau",0,0,0,0,0,1,-1,1
"Harganya terlalu mahal, pelayanannya pun standar",0,0,0,1,0,0,-1,1
"Pelayanannya ramah dan sigap, harganyapun murah meriah",0,0,1,1,0,0,1,1
Harganya tidak masalah tapi rasanya kurang enak ,-1,1,0,0,0,0,0,1
Pelayanan lumayan ramah tetapi agak lama perlu diperbaiki untuk kecepatan pelayanannya. Harganya memang agak mahal,0,0,0,1,0,0,1,1
"Pelayanannya cukup baik dan rasanya juga lumayan, harganya terlalu tinggi",0,1,0,1,0,0,1,1
"pelayanan dari karyawannya lumayan membantu, harganya selangit agak disayangkan karena porsinya kecil banget",0,0,0,1,0,0,-1,1
Rasanya sangat tidak memuaskan untuk harga yang tergolong mahal,-1,1,0,0,0,0,1,1
"Pelayannya agak kurang fokus saat menyampaikan pesanan karna yang dipesan sama yang datang agak beda, tapi nggak masalah, cukup baik. Untuk harga sangat merakyat",0,0,0,1,0,0,1,1
"Nggak perlu bayar mahal, puas banget. Pelayanan lumayan baik, tapi kurang antusias.",0,0,0,1,0,0,1,1
"Murah tapi puas makan. Pelayanan baik, tapi tidak cepat. Daging sapinya lumayan alot tapi gapapa masih bisa dinikmati.",0,1,0,1,0,0,1,1
"Harga yang dibanderol terlalu mahal, tidak sesuai dengan kualitas pelayanan yang biasa saja.",0,0,0,1,0,0,-1,1
"Pelayanan lumayan sigap. Nggak direkomendasiin, harga ga ngotak mahal banget",0,0,0,1,0,0,-1,1
"Harga pas dengan porsi yang diberikan. Pelayanan lumayan baik, tapi butuh perbaikan sedikit dalam hal ketelitian",0,0,0,1,0,0,0,1
Tempatnya tidak terlalu besar tetapi bersih cocok untuk tempat nongkrong. pelayannya cukup ramah dan makanannya tergolong murah.,0,0,0,1,0,1,1,1
"Makanan dan harga standar, kasirnya cuma 1 pelayanan jadi lama banget ga ke handle",0,1,-1,1,0,0,0,1
"Pelayanan cukup, harga sesuai sama porsi, rasa makanannya lumayan pas di lidah",0,1,0,1,0,0,0,1
"Makanannya biasa saja, suasananya pun tidak ada yang menarik. Harga lumayan pas dikantong",0,1,0,0,0,1,0,1
"Makanannya standar, tempatnya lumayan bersih dan nyaman. Tapi harganya kemahalan ",0,1,0,0,0,1,-1,1
"Hidangannya hambar dan tidak ada rasa, suasanannya juga biasa saja",-1,1,0,0,0,1,0,0
"Makanannya biasa saja, harganya pun sesuai dengan kualitas",0,1,0,0,0,0,0,1
Harganya tidak sebanding dengan porsi dan rasanya standar pada umumnnya,0,1,0,0,0,0,-1,1
"Harganya udah mahal, pelayanannya juga standar",0,0,0,1,0,0,-1,1
"kalo dilihat dari pelayanannya yang biasa-biasa aja, harganya sangat ga worth it",0,0,0,1,0,0,-1,1
"Sayangnya makanan dan minuman rasanya ga enak, ga sesuai sama harga. Harganya kemahalan.",-1,1,0,0,0,0,-1,1
Pelayanannya gak terlalu berkesan sih. Harga sangat menguras kantong ,0,0,0,1,0,0,-1,1
Harga makanan yang sangat teramat mahal padahal rasanya parah dan gak bisa dinikmati,-1,1,0,0,0,0,-1,1
"Memberikan pelayanan yang cukup memadai. Tapi, saya pikir harganya terlalu tinggi kalo dibandingkan dengan restoran kompetitor",0,0,0,1,0,0,-1,1
Pelayannya cukup ramah dan sopan,0,0,0,1,0,0,0,0
Pelayanannya cukup cepat tapi semoga bisa ditingkatkan lagi,0,0,0,1,0,0,0,0
Pelayanannya sesuai dengan standar restoran pada umumnya,0,0,0,1,0,0,0,0
Pelayannya cukup membantu dalam menjawab pertanyaan pelanggan,0,0,0,1,0,0,0,0
"Pelayanan di restoran ini cukup baik. Sayangnya, harga makanan di menu terasa agak mahal jika dibandingkan dengan kualitas dan porsi yang diberikan.",0,0,0,1,0,0,0,1
"Pelayanan cukup membantu. Harga makanan yang ditawarkan sangat terjangkau, terutama mengingat fasilitas dan porsi yang disediakan.",0,0,0,1,0,0,0,1
"Restoran ini memberikan pelayanan yang cukup memadai. Selain itu, harga makanan di sini sangat bersahabat dengan kantong, terutama mengingat kualitas yang ditawarkan.",0,0,0,1,0,0,1,1
"Menurutku harga yang ditawarkan sangat menguras kantong. Tapi untuk pelayanan di sini cukuplah, staf menjalankan tanggung jawab sebagaimana seharusnya.",0,0,0,1,0,0,-1,1
"Pelayanan ok lah, ga terlalu cekatan tapi masih bisa diandalkan. Untuk harganya standar aja sih",0,0,0,1,0,0,0,1
"Kualitas pelayanan di restoran ini rata-rata, tidak ada yang menonjol tapi juga tidak ada yang sangat buruk. Harga makanan terlalu mahal untuk ukuran porsi yang diberikan.",0,0,0,1,0,0,-1,1
Harga yang dikenakan bisa dibilang sangat terjangkau. Untuk pelayanan di sini menurutku biasa aja sih,0,0,0,1,0,0,1,1
Makanan dan minuman di sini relatif wajar sih harganya. Untuk pelayanan yang diberikan ya biasa aja sih sesuai dengan apa yang seharusnya dilakukan,0,0,0,1,0,0,0,1
"Harga makanannya terlalu tinggi ditambah PPN yang juga menguras dompet, tidak sesuai dengan porsinya. Stafnya ramah, tapi gak terlalu proaktif dalam membantu 
",0,0,0,1,0,0,-1,1
Pegawainya bekerja dengan cukup baik sebagaimana seharusnya. Harga yang ditawarkan tergolong standar ,0,0,0,1,0,0,0,1
"Harga yang ditawarkan sesuai aja sih. Stafnya bertugas sesuai dengan prosedur dan standar yang berlaku.
",0,0,0,1,0,0,0,1
"Pelayananya lama gak kaya mc donald , harusnya kalo resto rame tuh tambah lagi karyawanya, masa yg kasir ikut ngelayanin di dapur juga. Tempatnya ga kerawat jadi kurang bersih",0,0,-1,1,-1,1,0,0
"tempatnya cukup luas, ramai pelayanan baik",0,0,1,1,0,1,0,0
Buat yang suka ayam mah enak banget daging nya crispy pas lah pokoknya . Tempatnya juga bisa buat foto foto luas banget ada 2 lantai guys,1,1,0,0,1,1,0,0
"Tempatnya enak, ac dingin, pelayanan ramah. Harganya sangat terjangkau ",0,0,1,1,1,1,1,1
Tempatnya nyaman... Cumn makanan kurang higienis dari ayam kfc nemu rambut beberpa rambut.. Tolong di peehatikan,-1,1,0,0,1,1,0,0
"Kfc janur indah kelapa gading,pelayanan sangat buruk,terutama pelayanan online,kalo bisa pelayanan buat online nya di perbaiki,jangan yang makan di tempatnya di prioritas kan",0,0,-1,1,0,0,0,0
Makanannya enak. Sayangnya untuk antrian lama dan panjang. Dan petugas kurang siaga untuk membersihkan meja bekas pengunjung. ,1,1,-1,1,0,0,0,0
"sudah bukan favorit saya lagi. kualitas menurun, sambelnya tidak enak, ayamnya juga terlalu gurih. enakan resto ayam sebelah.. Harga masih cukup terjangkau",-1,1,0,0,0,0,0,1
"Saya sangat kecewa karena pelayanan nya sangat lambat,,,untuk customer maupun driver ojek online penanganan sangat lambat. Makanannya biasa aja ga ada yang spesial",0,1,-1,1,0,0,0,0
Pelayanannya standar untuk harga makanannya yang sangat mahal ,0,0,0,1,0,0,-1,1
"Pelayanan nya lambat,makanan sering kurang, dan masalah antrian nya tidak beraturan, kecewa berat. Rasanya oke",0,1,-1,1,0,0,0,0
"Pelayanan nya cepat, para pelayan ya gesit dan cekatan kalau sdg ramai, khususnya banyak yg berulang tahun.",0,0,1,1,0,0,0,0
Tempatnya luas namun dibatasi tdk bisa keatas dan lantai agak krg bersih,0,0,0,0,0,1,0,0
"Lebih mahal dr hrga normal. Tapi ada outdoornya. Ada tempat main anak2nya, ",0,0,0,0,1,1,-1,1
Makanan ttp enak tp tmpt nya ga enak bgt. Ac ga dingin lama bgt pelayanan nya,1,1,-1,1,-1,1,0,0
"Tempat luas, ada tempatnya permainan buat anak. Harganya murah banyak voucher diskon",0,0,0,0,1,1,1,1
"Bikin males dateng lagi ke kfc gading, bayar biaya parkir motor sebentar doang 5000 mahal banget",0,0,0,0,0,0,-1,1
"KFC... Harga Terjangkau untuk Kualitas dan Rasa yang Pasti. BUKA 24 jam, namun pelayanan HARUS ditingkatkan. standar kebersihan juga HARUS ditingkatkan dan disesuaikan dengan standar outlet KFC lainnya",1,1,0,1,0,1,1,1
"Lokasinya di dalam mall artha gading
  Tempat makan di tempatnya cukup luas",0,0,0,0,0,1,0,0
"Lahan parkir untuk sepeda motor kurang luas, mohon ditinjau lebih lanjut untuk menambah lahan parkir motor. Pelayanannya standar semoga bisa ditingkatkan lagi",0,0,0,1,-1,1,0,0
"Tempatnya lumayan nyaman klo malam hari apa lgi di bulan suci romadhon,,, sahur bersama keluarga. Harganya cukup terjangkau",0,0,0,0,0,1,0,1
tempatnya nyaman dan ada arena bermain anak,0,0,0,0,1,1,0,0
Pelayanan baik serta karyawan yg melayani cepat tanggap dan resto pun nyaman,0,0,1,1,1,1,0,0
"siapa yg ga kenal KFC. Makananya pasti enak-enak.
  tapi tempat parkiran nya hrs di benahi..bila perlu di gratiskan..soalnya ada tukang parkir ghaib..xixixi",1,1,0,0,-1,1,0,0
Good service.. cuma agak gelap tempatnya nya klo siang. Rasanya kurang nikmat,-1,1,1,1,0,1,0,0
"KFC langganan, pelayanan kurang sering antri panjang padahal masih ada counter lain tapi tutup. Kebersihan kamar mandi perlu ditingkatkan lagi.",0,0,-1,1,-1,1,0,0
"not bad ada indoor dan outdoor nya, cashier nya juga ada banyak jadi antrean tidak begitu lama",0,0,1,1,0,1,0,0
"Menuny macam2 & ga ngebosenin, pelayanan cepat & ramah. Harga sangat bersahabat",1,1,1,1,0,0,1,1
Tempat hang out yg enak.. Krn hrgnya lumayan terjangkau dan buka 24jam,0,0,0,0,1,1,0,1
Kalau rasanya standar. tempatnya kurang nyaman. Harga agak sulit dijangkau,0,1,0,0,-1,1,-1,1
Saus ny gk ada dan nasinya sedikit. Harganya mahal,-1,1,0,0,0,0,0,-1
Tolong dong pelayanan nya di tingkat kan lebih cepat lebih baik.  Semoga kedepannya lebih banyak diskon sehingga harga lebih terjangkau,0,0,0,1,0,0,0,1
Wah disini pelayanan nya lebih ditingkatkan lagi kualitasnya gan... Harganya pas dikantong,0,0,0,1,0,0,1,1
"Sama seperti KFC dimana2, tapi tempatnya nya yg ini amat adem, dan tentunya kalo laper habis shopping jng lupa mampir..",0,0,0,0,1,1,0,0
Ac panas. Ruangan ber ac tetapi seperti tidak menggunakan ac. Tolong lebih di utamakan kenyaman pengunjung. Makanannya juga standar ga enak-enak banget,0,1,0,0,-1,1,0,0
Ayamnya terenak bumbu meresap sampe ke dalam. Beda dengan tempatnya 2 lain. Harganya tergolong mahal memang,1,1,0,0,0,0,-1,1
Terlalu lama antriannya banyak waktu terbuang & promo kurang menarik maaf ya,0,0,-1,1,0,0,-1,1
Antrian cepat.. pelayanan kilat.. paket harga hemat..,0,0,1,1,0,0,1,1
Bersih tempatnya nya pelayanan ramah dan cepat,0,0,1,1,1,1,0,0
"Pelayanan cukup baik, tempatnya lumayan luas, ada 2 lantai",0,0,0,1,0,1,0,0
"Pelayanannya sangat buruk sekali,karyawannya bagaikan preman yang tidak di didik sama sekali. Makanannya makin ga enak kualitasnya menurun",-1,1,-1,1,0,0,0,0
Meeting point yang oke kalau malas ke Mal Kelapa Gading. Untuk harga dan rasa standar,0,1,0,0,0,1,0,1
"Pelayanannya cepat. Banyak metode pembayaran, cash dan debit serta aplikasi pay",0,0,1,1,0,0,0,0
Tempatnya Panas... Makan di tempatnya dgn keringatan. Makanannya juga kurang pas di lidah aku ,-1,1,0,0,-1,1,0,0
"Tempat luas & nyaman, ayamnya no. 1",1,1,0,0,1,1,0,0
Ayam goreng yg enak dan tempatnya nya nyaman utk makan bersama keluarga,1,1,0,0,1,1,0,0
tempatnya ramai banget jadi kurang nyaman,0,0,0,0,-1,1,0,0
Rasa ayamnya spesial....aroma keemasan,1,1,0,0,0,0,0,0
rasa ayam goreng sangat enak,1,1,0,0,0,0,0,0
"Saya baru kali ini di A&W ROYAL, tolong lebih ramah dalam melayani.. Masukan aja smg sukses",0,0,0,1,0,0,0,0
"lusa dari sini pesen burger, dagingnga agak aneh, bau, abis makan jd diare muntah2. Harganya ga masuk akal pula",-1,1,0,0,0,0,-1,1
"Ayamnya terlalu banyak minyak hingga terlihat basah, porsinya sedikit dan harganya mahal jika dibandingkan dengan fast food lainnya",-1,1,0,0,0,0,-1,1
"Menu ayamnya juga kurang enak, terlalu kecil dan kering. Ini memiliki outlet lain di lantai dasar dekat pintu masuk mal. Saya bertanya-tanya mengapa setiap A&W yang saya kunjungi memiliki layanan yang buruk, mereka benar-benar harus meningkatkan kualitas staf.",-1,1,-1,1,0,0,0,0
Maaf saya penggemar A&W untuk kebersihannya tolong ditingkatkan lagi bekas orang makan sampai berserakan gak di beresin minta tolong pegawainya iya2 doank....,0,0,-1,1,0,0,0,0
"tadi makan A&W yang di lantai 1 seberang breadtalk, pelayanannya sangat tidak memuaskan. Rasanya juga biasa aja",0,1,-1,1,0,0,0,0
Katanya restoran cepat saji. Tp pelayanan lama sekali. Makanannya juga ga hangat udah dingin ga enak lagi,-1,1,-1,1,0,0,0,0
"Lambat sekali pelayanannya, Unknow product knowledge..Menu banyak yg tidak ready dan belum di siapkan bahannya",0,0,-1,1,0,0,0,0
"beda jauh rasa ayam dan tekstur luar ayam nya beda jauh dengan waktu 5 tahun yang lalu,seharusnya rasanya harus dipertahankan,nyesel,semoga kedepannya bisa lebih baik lagi",-1,1,0,0,0,0,0,0
"Pelayanan sangat buruk, mentang mentang yang beli karyawan, masak pesanan udah jadi nggak di panggil. Pesn minum apa di kasih apa hadehhh minta tolong yaa, jangan di beda bedain. Pembeli adalah raja tidak melihat pangkat dan derajat!!",0,0,-1,1,0,0,0,0
Pelayanan petugas kebersihan Sangat Buruk Sekali terhadap pengunjung. Sehingga rencana makan di tempatnya kami batalkan... kami sekeluarga berlima kecewa sekali terhadap sikap dan pelayanan kebersihan...,0,0,-1,1,0,0,0,0
"Kasir jutek. Makanan lama dateng, porsi kecil tapi overpriced. Satu2nya yg ga mengecewakan cuma waffle ice creamnya doang.",0,0,-1,1,0,0,-1,1
"Pelayanan sangat tidak memuaskan...pesan wafel ice cream 1 aja, menunggu hampir 1jam...tolong dibenahi manajemennya. Tempatnya juga kotor ga dibersihkan",0,0,-1,1,-1,1,0,0
