Review,y_rasa,c_rasa,y_pelayanan,c_pelayanan,y_tempat,c_tempat,y_harga,c_harga
"Rasanya cukup enak untuk ukuran fast food, meskipun tidak ada yang terlalu istimewa. Bisa jadi pilihan untuk makan cepat dengan harga yang terjangkau",0,1,0,0,0,0,1,1
"Ayamnya lumayan renyah, meski terkadang sedikit terlalu berminyak. Tapi untuk harganya murah dan terjangkau",0,1,0,0,0,0,1,1
"Minumannya cukup menyegarkan, tapi dessertnya bisa lebih baik lagi. Pelayanannya cukup cepat dan efisien, meskipun beberapa staf tampak kurang ramah",0,1,0,1,0,0,0,0
"Dekorasinya standar dan pencahayaan cukup baik. Sayangnya, pendingin ruangan kurang efektif di beberapa sudut. Beberapa staff kurang ramah namun ada yang melayani dengan baik ",0,0,0,1,0,1,0,0
Harganya masih masuk akal untuk menu fast food,0,0,0,0,0,0,0,1
"Secara keseluruhan, harga sebanding dengan kualitas dan porsi yang diberikan",0,0,0,0,0,0,0,1
"Pelayanan cukup memadai, tapi tidak mengecewakan, dan harga masih terjangkau untuk kantong saya.",0,0,0,1,0,0,0,1
"Waiternya sigap, tapi kurang ramah, dan harga standar, masih terjangkau.",0,0,0,1,0,0,0,1
"Kasirnya baik, tapi prosesnya agak lama, dan harga cukup standar untuk restoran.",0,0,0,1,0,0,0,1
"Pelayanan ramah, tapi agak lambat, dan harga masih terjangkau, nggak mahal-mahal amat.",0,0,0,1,0,0,0,1
"Waiternya sopan, tapi tidak terlalu perhatian, dan harga sesuai dengan porsi yang didapat.",0,0,0,1,0,0,0,1
"Kasirnya informatif, tapi antriannya panjang, dan harga masih terjangkau, nggak terlalu tinggi.",0,0,0,1,0,0,0,1
"Pelayanan cukup memadai, tapi tidak mengecewakan, dan harga lumayan sesuai sama rasanya.",0,0,0,1,0,0,0,1
"Waiternya sigap, tapi kurang ramah, dan harga masih terjangkau, nggak terlalu murah.",0,0,0,1,0,0,0,1
"Kasirnya baik, tapi prosesnya agak lama, dan harga pas lah buat makan di sini.",0,0,0,1,0,0,0,1
"Pelayanan ramah, tapi agak lambat, dan harga cukup sebanding dengan kualitas makanan.",0,0,0,1,0,0,0,1
"Rasanya biasa aja si, ga ada yang istimewa kurang sesuai sama harganya yang tergolong mahal",0,1,0,0,0,0,-1,1
"Pelayanannya oke, tapi mungkin bisa lebih ditingkatkan lagi.  Untuk tempatnya juga kalau bisa ditingkatkan lagi kebersihannya",0,0,0,1,0,1,0,0
"Karyawannya ramah si tapi kerjanya lambat jadi antrian panjang.  Makanan yang disajikan cukup standard, tidak ada yang menonjol",0,1,0,1,0,0,0,0
"Rasanya lumayan, tapi masih banyak yang harus ditingkatkan. Tapi sesuai harga si",0,1,0,0,0,0,0,1
"Pelayannya cukup sopan, cuma kurang cekatan. Dan untuk harganya nggak murah dan gak mahal, biasa aja",0,0,0,1,0,0,0,1
Harga di restoran ini sesuai sama ekspektasi saya dengan kualitas rasa yang standar,0,1,0,0,0,0,0,1
"Harga yang dikenakan terlalu tinggi, tidak sesuai dengan pelayanan yang diberikan.",0,0,-1,1,0,0,-1,1
"Mahal banget woi, harganya ga sesuai sama rasanya. Ga worth it!",0,1,0,0,0,0,-1,1
"Udah mahal, porsinya masih dikit. Nyesel! Pelayannya juga nyebelin banget sangat tidak ramah!",0,0,-1,1,0,0,-1,1
"Harganya lumayan terjangkau, gak murah tapi masih okee. Cuman sayang rasanya kurang pas dilidah saya",-1,1,0,0,0,0,0,1
"Suasananya sumpek, bikin nafsu makan hilang. Pelayanannya juga standar",0,0,0,1,-1,1,0,0
"Pelayanannya membantu tapi kurang senyum, tempatnya juga kurang nyaman karena pengap, gak ada udara segar",0,0,0,1,-1,1,0,0
"Harga makanan di sini masih masuk akal di banding resto sebelah, dan makanananny juga cukup enak kok",0,1,0,0,0,0,0,1
Tolong perbaiki management pada saat buka puasa pelayananannya sangat lambat meja meja banyak yg belum dibersihkan jadi kotor,0,0,-1,1,-1,1,0,0
"Lokasi susah parkir, tempat tidak nyaman untuk makan, nasi keras, ayam tidak fresh",-1,1,0,0,-1,1,0,0
Harganya murah meriah.. rasanya lumayanlah,0,1,0,0,0,0,1,1
Ayam nya banyak kan tepungnya Es krim nya mahal tapi sedikit isinya,-1,1,0,0,0,0,-1,1
"Rasa makanannya lumayanlah standar, harga terjangkau",0,1,0,0,0,0,1,1
"Tempatnya lumayan si, tapi pelayanan sangat tidak ramah",0,0,-1,1,0,1,0,0
"Rasanya bolehlah lumayan , harganya standar",0,1,0,0,0,0,0,1
"Ya, standar lah harga dan pelayanan di sini",0,0,0,1,0,0,0,1
"Gak mahal-mahal banget, tapi juga bukan murahan. Karena rasanya juga lumayan",0,1,0,0,0,0,0,1
"Buat makanan biasa, harganya juga biasa.",0,1,0,0,0,0,0,1
"Rasanya cukup standar, tidak ada yang istimewa, dan sayangnya pelayanannya juga tidak terlalu ramah",0,1,-1,1,0,0,0,0
"Makanannya cukup bisa diterima, namun pelayanannya lambat dan sering terjadi kesalahan dalam pesanan. Harganya padahal udah tergolong mahal",0,1,-1,1,0,0,-1,1
"Tempatnya bersih, tetapi kurang nyaman karena AC sering mati dan harganya relatif",0,0,0,0,0,1,0,1
"Dekorasinya sederhana dan tempatnya agak sempit, tetapi harga makanannya masih terjangkau",0,0,0,0,-1,1,1,1
"Makanan di sini rasanya cukup biasa saja, dan tempatnya juga kurang menarik dan agak sempit",0,1,0,0,-1,1,0,0
"Rasa makanannya lumayan, tapi sayangnya tempatnya kurang bersih dan cukup berisik",0,1,0,0,-1,1,0,0
"Ayamnya kurang gurih, dan area makannya sering kali kotor dan tidak nyaman",-1,1,0,0,-1,1,0,0
"Lokasinya kurang strategis dan tempatnya sempit, meskipun harga makanannya terjangkau.",0,0,0,0,-1,1,0,1
"Makanan di sini rasanya lumayan, tapi staf seringkali tidak tersenyum dan kurang membantu. Harganya juga kurang terjangkau",0,1,-1,1,0,0,-1,1
"Lokasinya kurang strategis dan tempat duduknya tidak banyak, serta pelayanannya kurang cepat",0,0,-1,1,-1,1,0,0
"Staf tidak peduli dengan Anda atau pesanan Anda. Mereka mengabaikanmu sepenuhnya. Selalu memainkan ponselnya, berpura-pura tidak mendengar atau melihat Anda. Tempatnya tidak terlalu bersih. Tampak seperti gudang dengan kotak-kotak dan barang-barang pengiriman di mana-mana.",0,0,-1,1,-1,1,0,0
"Harganya standar, tapi sayangnya makanannya tidak sesuai dengan harapan saya.",-1,1,0,0,0,0,0,1
"Untuk harga, restoran ini cukup wajar, namun tempatnya kurang bersih.",0,0,0,0,-1,1,0,1
"Harganya masih masuk akal, tapi rasa makanannya sangat hambar.",0,1,0,0,0,0,0,1
"Biaya makanan cukup masuk akal, namun pelayanan sangat lambat.",0,0,-1,1,0,0,0,1
"Harga sesuai dengan restoran sejenis, tapi suasananya tidak nyaman.",0,0,0,0,-1,1,0,1
"Harganya lumayan bisa dibilang terjangkau, namun saya kecewa dengan rasa makanannya.",-1,0,0,0,0,0,0,1
"Harga makanannya biasa saja, tapi makanannya sedikit hambar kaya kurang tastenya",0,1,0,0,0,0,0,1
"Harga menu cukup masuk akal, namun tempatnya berisik dan tidak nyaman.",0,0,0,0,-1,1,0,1
"Biaya makanannya wajar, tapi rasa makanannya jauh dari enak.",-1,1,0,0,0,0,0,1
"Harga tidak masalah, tapi pelayanan di sini sangat lambat.",0,0,-1,1,0,0,0,1
"Harganya tidak begitu mahal, namun tempat ini perlu perbaikan kebersihan.",0,0,0,0,0,1,0,1
"Harga makanannya standar, tapi rasa makanannya tidak enak.",-1,1,0,0,0,0,0,1
"Harga yang ditawarkan biasa saja, namun pelayanannya sangat buruk.",0,0,-1,1,0,0,0,1
"Harganya sesuai, tapi tempatnya sangat tidak nyaman dan berisik.",0,0,0,0,-1,1,0,1
"Harganya wajar, namun rasa makanan kurang memuaskan.",-1,1,0,0,0,0,0,1
Harga menu standar dan pelayanan juga biasa saja si oke lah,0,0,0,1,0,0,0,1
"Harga makanannya biasa, namun suasananya sangat tidak menyenangkan.",0,0,0,0,-1,1,0,1
"Harga tidak terlalu tinggi, tapi rasa makanannya mengecewakan.",-1,1,0,0,0,0,0,1
"Harga yang ditawarkan sesuai, namun pelayanan lambat.",0,0,-1,1,0,0,0,1
"Harganya standar, tapi tempatnya sangat kotor dan tidak terawat.",0,0,0,0,-1,1,0,1
"Harga yang ditawarkan sesuai, namun rasa makanannya mengecewakan.",-1,1,0,0,0,0,0,1
"Harganya masuk akal, tapi pelayanan sangat lambat dan tidak ramah.",0,0,-1,1,0,0,0,1
"Harga makanannya tidak masalah, namun tempatnya kurang nyaman.",0,0,0,0,-1,1,0,1
"Harganya standar, tapi rasa makanannya jauh dari yang diharapkan.",-1,1,0,0,0,0,0,1
"Harga yang ditawarkan cukup adil, namun pelayanan tidak memuaskan.",0,0,-1,1,0,0,0,1
"Harganya tidak terlalu mahal, tapi tempatnya sangat berisik dan tidak nyaman.",0,0,0,0,-1,1,0,1
"Harga makanannya wajar, namun rasa makanan sangat buruk.",-1,1,0,0,0,0,0,1
"Harga sesuai, tapi pelayanan lambat dan tidak profesional.",0,0,-1,1,0,0,0,1
"Harga makanannya standar, namun tempatnya tidak terawat dengan baik.",0,0,0,0,-1,1,0,1
"Harga tidak masalah, tapi rasa makanannya tidak enak sama sekali.",-1,1,0,0,0,0,0,1
"Harganya lumayanlah terjangkau, namun pelayanan sangat lambat dan tidak ramah.",0,0,-1,1,0,0,0,1
"Harga yang ditawarkan biasa, tapi tempatnya kotor dan tidak nyaman.",0,0,0,0,-1,1,0,1
"Harga makanannya tidak terlalu mahal banget, namun rasa makanannya sangat mengecewakan.",-1,1,0,0,0,0,0,1
"Harganya wajar, tapi pelayanannya sangat lambat dan tidak sopan.",0,0,-1,1,0,0,0,1
"Harga sesuai dengan restoran sejenis, namun tempatnya berantakan.",0,0,0,0,-1,1,0,1
"Harga makanannya wajar, namun pelayanan sangat lambat dan tidak ramah.",0,0,-1,1,0,0,0,1
"Harga yang ditawarkan cukup adil, namun tempatnya sangat tidak nyaman.",0,0,0,0,-1,1,0,1
"Harganya tidak terlalu tinggi, namun rasa makanannya sangat buruk.",-1,1,0,0,0,0,0,1
"Harga makanannya sesuai, tapi pelayanan sangat lambat dan tidak ramah.",0,0,-1,1,0,0,0,1
"Harga standar, namun tempatnya sangat kotor dan tidak terawat.",0,0,0,0,-1,1,0,1
"Harganya masuk akal, tapi rasa makanannya sangat mengecewakan.",-1,1,0,0,0,0,0,1
"Harga yang ditawarkan wajar, namun pelayanan sangat lambat.",0,0,-1,1,0,0,0,1
"Harga makanannya biasa saja, namun tempatnya berisik dan tidak nyaman.",0,0,0,0,-1,1,0,1
"Harga tidak masalah, tapi rasa makanannya sangat tidak enak.",-1,1,0,0,0,0,0,1
"Harga yang ditawarkan cukup wajar, namun pelayanannya sangat buruk.",0,0,-1,1,0,0,0,1
"Harga sesuai, tapi tempatnya sangat berantakan dan tidak nyaman.",0,0,0,0,-1,1,0,1
"Harganya masih sesuai, namun rasa makanannya sangat mengecewakan.",-1,1,0,0,0,0,0,1
"Harga makanannya standar, tapi pelayanan sangat lambat dan tidak profesional.",0,0,-1,1,0,0,0,1
"Harga yang ditawarkan cukup sesuai, tempatnya juga lumayan ",0,0,0,0,0,1,0,1
Saya sangat nyaman makan ditempatnya. untuk pelayanan terkesan kurang ramah tapi cekatan dalam bekerja,0,0,0,1,1,1,0,0
"Suka dengan pelayanan mcDonald's bandung buah batu ramah..pelayananya cepat, bersih dan kasirnya sangat detail menjelaskan paket menu makananya sangat sabar dan ramah..suasananya juga asik untuk bawa keluarga makan di macdonald buah batu..thank you",0,0,1,1,1,1,0,0
Pelayanan nya sangat cepat. Pegawainya ramah dan tanggap dalam memberi kan arahan. Kualitas makanan bersih dan higienis. Kamar mandi bersih dan saya senang makan disini,0,0,1,1,1,1,0,0
"Sangat nyaman dan betah sekali di sini. Pelayanannya cepat dan ramah, bersih, dan yang paling penting tempatnya nya bikin good feeling banget.",0,0,1,1,1,1,0,0
"Tempat yang nyaman dan pelayanan yang baik, sangat di rekomendasikan untuk menikmati akhir pekan disini",0,0,1,1,1,1,0,0
tempatnya nyaman.pelayanan sangat bagus.kebersihan terjaga dan pegawai nya ramah dan baik hati.sya sangat senang dengan makan disini,0,0,1,1,1,1,0,0
"McDonalds selalu menjadi pilihan kami sekeluarga. Lokasi di buah batu Bandung sangat strategis, mudah dicapai, udaranya bersih dan sejuk. Makanan dan minumannya lengkap. Layanannya ramah. Pokoknya sangat menyenangkan. Okay bangets",0,0,1,1,1,1,0,0
"Best place to eat and hangout with your friends. Paling enak udah pokoknya wifian di mcd sambil minum ice coffee.. Kumpul ama temen temen terus ngobrol ngobrol sampai sore, sampai malem atau sampai pagi lagi juga boleh.. Hahaha.. Da best dah pokoknya.. Ya dimana mana mcd mah sama yak.. Yang paling penting ya wifinya cuy wkwk",0,0,1,1,1,1,0,0
MCD disini bisa pilih menu sendiri pake layar / monitor screen deket pintu masuk. Bisa tanya satpam klo bingung cara pke nya. Jadi skrg ga antri lagi milih menu di mcd nya. Parkiran gede pisan. Rapi. Humble staffs and clean place.,0,0,1,1,1,1,0,0
"Lokasinya strategis,bersih dan pelayanan mantap,kalo ke bdg pasti mampir ke McD Buahbatu ini... Selain banyak pilihan menu tempatnya nya enak untuk nongkrong bareng temen/keluarga..",0,0,1,1,1,1,0,0
"Tempatnya enak, pelayanannya baguss, sangat wort it, penyajiannya cepattt, mantapp",0,0,1,1,1,1,0,0
"Tempat ini sangat nyaman untuk tempatnya makan bersama keluarga dan acara keluarga, pelayanan sangat ramah dan baik.",0,0,1,1,1,1,0,0
Cocok banget buat yg gak cuma makan siap saji tapi juga cari kenyamanan tempatnya . Desainnya mantul gak kaleng-kaleng dan bersih pake banget. Lahan parkirnya juga oke luas. Soal pelayanan udah pasti ramah. Ada arena main anak-anak,0,0,1,1,1,1,0,0
Lokasi pas dan bagus ... kebersihan waw ...dijaga baik .... layanan ... ramah terutsma Mc Cafe nya. Harganya memang cenderung mahal,0,0,1,1,1,1,-1,1
tempatnya nya sangat bersih dan terawat dengan baik. Begitu memasuki restoran akan merasakan kebersihan dan kerapian yang konsisten di seluruh area. Staf selalu tampak sibuk membersihkan meja dan menjaga kebersihan area umum. Toilet juga sangat bersih dan terjaga dengan baik.,0,0,1,1,1,1,0,0
"Pelayanan di sini  bagus, suasana makan disini sangat nyaman, nyaman untuk mengajak rekan dan teman teman, sahabat untuk berkumpul. Pokoknya rekomen banget untuk kalian datang kesini. Thanks",0,0,1,1,1,1,0,0
"Pelayanan nya oke , ramah dan tempatnya nya juga bersih .
  Penyajian cepat
  Rasa ayam original nya beda dari yang lain lebih gurih .
  Suasananya juga cocok buat nongkrong sama teman teman .",0,0,1,1,1,1,0,0
Wah pokoknya di sini recommend banget untuk makan bersam keluarga ataupun sendiri.....luar bisa dri segi pelayanannya yg ramah dan makaananya enak enak,0,0,1,1,1,1,0,0
"Tempat yg nyaman untuk makan bersama keluarga & pelayanan yg cepat, ramah & bersih tempatnya nya. Recomend",0,0,1,1,1,1,0,0
"tempatnya nya bersih, pelayanan sangat ramah dan cepat. anak-anakku betah dan nyaman makan disini. Ada drive thru dan juga dine in. Memuaskan sekali",0,0,1,1,1,1,0,0
"Kesini beli lewat drive thru, pelayanan cepat sesuai standar mcd lainnya. Lokasi strategis juga, jadi ga susah carinya. Good job!",0,0,1,1,1,1,0,0
"tempatnya Bersih suasananya enak,,pelayanannya jg bagus ramah2 pokonya MCD tmpt yg Recommended bgt utk Makan bersama keluarga",0,0,1,1,1,1,0,0
"Tempat yang nyaman untuk bersantai bersama teman dan keluarga. Pelayanan memuaskan, ada area untuk anak, lahan parkir juga luas.",0,0,1,1,1,1,0,0
Pelayanannya ramah dan cepat. harga cocok buat pelajar,0,0,1,1,0,0,1,1
"Pelayanan cepat, mantaap. Ada promo discount donk utk Mitra Grab online, pasti rajin mampir deeh.. ????",0,0,1,1,0,0,1,1
"Pelayanan nya bagus,pegawai nya ramah2&murah senyum. Harga nya sesuai dengan kantong mahasiswa.suasana resto nya sangat adem&bnyak2 buat spot selfie",0,0,1,1,1,1,1,1
"Pelayanan yang sangat baik, menu nya begitu banyak dan sangat cepat dalam penyajiannya. tempatnya nya bersih dan fasilitas nya juga baik. Rekomen banget biar bisa dateng lagi kesini",0,0,1,1,1,1,0,0
"tempatnya makan siap saji yg selalu jadi andalan , pesanan yg lebih praktis karena pakai screen digital , fasilitas yg semakin lengkap , pelayanan yg ramah ,",0,0,1,1,1,1,0,0
"Mantap, makanan biasa saja tapi pelayanan sangat baik dan sopan dengan suasana yang nyaman pula, Yo Bro sis merapat",0,1,1,1,1,1,0,0
"Tempatnya menyenangkan dan nyaman dengan arel parkir yg lumayan luas, sehingga saat menikmati makanan jadi tenang.
  Pelayanan pegawai ramah dan memberi informasi yg cukup untuk kami memilih menu.",0,0,1,1,1,1,0,0
Keren banget buat bawa keluarga karena tempatnya nyaman dan penyajian nya sangat cepat,0,0,1,1,1,1,0,0
"Tempatnya bagus, bersih, nyaman, pelayanan yang sangat ramah. Harganya ga sesuai",0,0,1,1,1,1,-1,1
"Tempat yg nyaman buat makan sama keluarga/ buat sekedar nongkrong bersama teman, bersih dan ramah pelayanan.",0,0,1,1,1,1,0,0
"Cepet ga perlu antri lama, lumayan enak tempatnya nya buat rapat",0,0,1,1,1,1,0,0
pelayanan yang sangat ramah dan memuaskan. serta makanan yg higienis. semoga akan selalu menjadi tempatnya makan favorit bagi seluruh masyarakat Indonesia,0,0,1,1,1,1,0,0
"Tempat strategis, tapi parkirannya sempit. Staff nya sigap langsung beresin meja. Harganya cenderung mahal",0,0,1,1,0,1,-1,1
pelayanan cepat dan baik.  suasana nya juga bersih dan nyaman. Harganya kurang bersahabat,0,0,1,1,1,1,-1,1
"tempatnya asik dan nyaman, comfortable buat nongkrong bersama teman dan keluarga , Pelayanan nya juga ramah, Sukaaaa banget",0,0,1,1,1,1,0,0
"Tempat lumayan nyaman, pelayanan bagus dan ramah untuk penyandang disabillity karena ada lift. Harganya bersahabat",0,0,1,1,0,1,1,1
Tolong buat mcdonald ditingkatkan ya pelayanannya. Dicek dulu apakah sesuai dengan orderan saya atau tidak jangan asal kasih trus ngluyur entah kemana itu staffnya. Mana rasanya makin ga enak ,-1,1,-1,1,0,0,0,0
"Pelayanannya gak ramah, bikin males balik lagi. Harganya juga makin naik ",0,0,-1,1,0,0,-1,1
"Harga makanan di sini sesuai dengan kualitasnya, tetapi pelayanannya sangat lambat.",0,0,-1,1,0,0,0,1
"Menu harganya standar, namun pelayanan yang lamban membuat pengalaman makan jadi kurang menyenangkan.",0,0,-1,1,0,0,0,1
"Harga makanannya sepadan dengan porsi yang diberikan, tapi pelayan tidak responsif.",0,0,-1,1,0,0,0,1
"Harganya terjangkau, sayangnya pelayan sering mengabaikan panggilan.",0,0,-1,1,0,0,0,1
"Harga cukup wajar, tapi pelayanannya sangat tidak memuaskan.",0,0,-1,1,0,0,0,1
"Untuk harga, restoran ini cukup kompetitif, namun pelayanan sangat mengecewakan.",0,0,-1,1,0,0,0,1
"Makanan di sini harganya sesuai, tapi pelayanannya perlu banyak perbaikan.",0,0,-1,1,0,0,0,1
"Harga pas di kantong, pelayanannya lumayan oke lah",0,0,0,1,0,0,0,1
"Harga makanan di sini tidak mahal, tetapi pelayanan buruk membuat saya ragu untuk kembali.",0,0,-1,1,0,0,0,1
"Harganya normal, pelayanannya lumayan baik",0,0,0,1,0,0,0,1
"Harga makanannya cukup adil, tetapi pelayanan yang lambat membuat kami kecewa.",0,0,-1,1,0,0,0,1
"Harga wajar, tapi pelayan tidak ramah dan lambat dalam melayani.",0,0,-1,1,0,0,0,1
"Harga makanannya oke, namun pelayanannya jauh dari memuaskan.",0,0,-1,1,0,0,0,1
"Harga di restoran ini tidak terlalu mahal, tapi pelayanan sangat mengecewakan.",0,0,-1,1,0,0,0,1
"Harga makanan di sini setara dengan restoran lain, namun pelayanannya lambat dan kurang profesional.",0,0,-1,1,0,0,0,1
"Harga oke, tapi pelayanan benar-benar perlu ditingkatkan.",0,0,-1,1,0,0,0,1
"Makanannya cukup terjangkau, dan pelayanannya juga standar biasa aja",0,0,0,1,0,0,0,1
"Harga menu standar, tapi pelayanannya memuaskan",0,0,1,1,0,0,0,1
"Harga cukup reasonable, tapi rasanya kurang sesuai selera saya.",0,1,0,0,0,0,0,1
"Harganya sepadan dengan kualitas, tapi tempatnya kurang nyaman sangat kotor dan tidak terawat",0,0,0,0,-1,1,0,1
"Harga pas di dompet, tapi rasanya kok agak aneh ya",-1,1,0,0,0,0,0,1
"Harga standar, tapi tempatnya bersih dan nyaman",0,0,0,0,1,1,0,1
"Harga tidak terlalu mahal, pelayanannya juga standar .",0,0,0,1,0,0,0,1
Harganya biasa saja. Tempatnya nyaman untuk kumpul keluarga.,0,0,0,0,1,1,0,1
"Harga makanannya sesuai  dan tempatnya cozy banget, bikin betah nongkrong.",0,0,0,0,1,1,0,1
Harga cukup wajar dengan rasa yang kurang nikmat,0,1,0,0,0,0,0,1
"Harga tidak masalah, tapi tempatnya kumuh, bikin males makan di sini.",0,0,0,0,-1,1,0,1
"Untuk harga, cukup sebanding sama porsinya. Gak cocok buat makan bersama keluarga. Ngga kelamaan nunggu makanan datang.",0,0,1,1,-1,1,0,1
"Harganya lumayan, nggak mahal-mahal amat. Tempatnya terasa suram dan menyedihkan. Stafnya selalu sigap dalam menangani situasi yang tidak terduga.",0,0,1,1,-1,1,0,1
"Harga makanan cukup standar, kebersihan tempat sangat buruk, rasa makanan juga tidak nikmat dan seperti kurang bumbu",-1,1,0,0,-1,1,0,1
Harga cukup wajar. Saya harap pelayanan bisa ditingkatkan lagi.,0,0,0,1,0,0,0,1
"Harganya sesuai dengan kualitas, pelayanannya juga gak terlalu cekatan",0,0,0,1,0,0,0,1
Harganya pas lah buat makan di sini. Tempat makannya kecil dan sumpek. Pelayanan responsif terhadap kebutuhan pelanggan.,0,0,1,1,-1,1,0,1
"Harga tidak terlalu mahal, makanan gosong dan pahit rasanya. Pelayanannya cukup memuaskan",-1,1,0,1,0,0,0,1
"Harga makanan cukup wajar. Pelayanan cukup baik, tapi lambat.",0,0,0,1,0,0,0,1
"Rasanya kurang enak karena kurang fresh, tapi harganya lumayan terjangkau sii, terlebih lagi tempatnya nyaman buat nongkrong",-1,1,0,0,1,1,0,1
Harganya sesuai dengan porsi yang didapat. Namun rasanya kurang istimewa biasa saja.,0,1,0,0,0,0,0,1
"Harga makanan cukup terjangkau tapi rasanya ga ada yang special, standar aja",0,1,0,0,0,0,0,1
Harga dan pelayanannya standar tapi tempatnya estetik dan nyaman,0,0,0,1,1,1,0,1
"Harga lumayan pas di kantong, tapi rasa dan pelayanannya perlu ditingkatkan lagi",0,1,0,1,0,0,0,1
"Harga makanan cukup terjangkau, dan pelayanannya baik bangett the best pokoknya",0,0,1,1,0,0,0,1
"Harga pas di kantong pelajar, dan pelayanannya cukup memadai",0,0,0,1,0,0,1,1
"Harga cukup wajar, pelayanannya cukup cepat, makanannya lumayan tapi kurang variatif. ",0,1,0,1,0,0,0,1
"Harga tidak terlalu mahal, namun pelayanannya sangat baik dan cepat",0,0,1,1,0,0,0,1
"Harga makanan cukup terjangkau, namun tempatnya berdebu, gak nyaman buat makan.. Untuk pelayanan cukup baik dan ramah",0,0,0,1,-1,1,0,1
"Harga pas di kantong, dan yang pasti pelayanannya selalu juara",0,0,1,1,0,0,1,1
"Harga cukup adil dan ga kecewa sama pelayanannya, selalu memuaskan",0,0,1,1,0,0,0,1
"Harga standar, tapi pelayanannya luar biasa ramah banget ",0,0,1,1,0,0,0,1
"Pelayanan lambat, pembayaran pake edc juga eror2, pesan paha atas dikasih dada. Harganya ga masuk akal",0,0,-1,1,0,0,-1,1
"Tempatnya luas, bersih, dan nyaman. Layanan baik dan ramah. Harganya terjangkau, sekarang banyak pilihan menu yg harganya murah terutama menu breakfast dan cemilan jadi ga bikin kantong jebol.",0,0,1,1,1,1,1,1
"lokasi cukup luas, bersih dan nyaman. Pelayanannya standar, harganya menengah ke atas",0,0,0,1,1,1,-1,1
"pelayanannya cepat, tempatnya nyaman ada yg indoor sama outdoor, ada fasilitas playground utk anak anak main",0,0,1,1,1,1,0,0
"Tempatnya bersih, nyaman. Sudah menggunakan digital order machine. Sayang banget makanannya sempet ga sesuai sama pesanan (di minuman & ayam).",0,0,-1,1,1,1,0,0
"Lokasi strategis di wilayah sekarno hatta... vibe nya cukup oke... untuk pennyajian makanan dari sejak order, cukup cepat.... Untuk makanan, rasanya standard..",0,1,0,1,0,1,0,0
"Suasana disini nyaman, hanya saja kalo penuh pengunjung susah sekali cari tempat duduk untuk keluarga yg datang kalo lebih dari 4 orang. Pelayanannya cukup lama tapi masih bisa ditoleransi",0,0,0,1,0,1,0,0
Standard pelayanan sesuai prosedur.. Untuk harganya sangat terjangkau untuk rasa yang lumayan enak,0,1,0,1,0,0,1,1
"Pegawai ramah dan sangat membantu jika dimintai tolong, pelayanan cepat. Namun harganya agak mahal",0,0,1,1,0,0,-1,1
Rasanya ga sesuai sama harganya. Rasanya ga enak tapi harganya mahal banget,-1,1,0,0,0,0,-1,1
"Lebih murah makan di tempat lain, harga overpriced untuk rasa yang biasa aja",0,1,0,0,0,0,-1,1
"Harga sekelas restoran bintang lima, tapi kualitasnya biasa.",0,1,0,0,0,0,-1,1
"Nggak cocok buat dompet mahasiswa, harga ga bersahabat. Tempatnya juga ga enak buat nongkrong",0,0,0,0,-1,1,-1,1
"Bener-bener kecewa, harga tinggi kualitas rendah.",-1,1,0,0,0,0,-1,1
"Udah mahal, rasanya juga biasa aja.",0,1,0,0,0,0,-1,1
Drive thru cepat. Penyiapan makanan cepat. Yang kurang adalah harga makanannnyaaaaa wkwkwkwk,0,0,1,1,0,0,-1,1
"Harganya murah meriah, apalagi tadi pas lagi promo gopay diskon 50% mantap kan hehe. Pelayanannya ramah cepet juga",0,0,1,1,0,0,1,1
"Tempat tidak terlalu luas, tapi tetap lumayan nyaman. Dengan pelayanan yang baik, ada pelayanan mandiri dan melalui kasir.",0,0,1,1,0,1,0,0
Harga makanan di sini pas lah. Desain tempat terlalu sederhana dan tidak menarik. Pelayanannya punya sentuhan personal yang istimewa.,0,0,1,1,-1,1,0,1
"Untuk harga, cukup sebanding sama porsinya. Gak cocok buat makan bersama keluarga karena tempatnya sangat ramai dan sumpek. Tapi sejauh ini pelayanan tetap cepat dan gak bikin kelamaan nunggu makanan datang.",0,0,1,1,-1,1,0,1
"Rasa makanannya bikin pengen nangis, kecewa banget tapi untung harganya enggak mahal. Pelayanan lumayan, tapi semoga bisa lebih baik.",-1,1,0,1,0,0,1,1
"Harganya sangat ramah di kantong. Pelayanan cukuplah, gak terlalu cekatan tapi lumayan responsif",0,0,0,1,0,0,1,1
"Perut kenyang dengan harganya yang nggak bikin kantong bolong. Pelayannya baik dan ramah, tapi kerjanya lumayan lambat ketika mengantarkan makanan. Mie gorengnya kayak mie instan murahan.",0,0,0,1,0,0,1,1
"Untuk karyawannya, disini yang termasuk sangat ramah dan sabar menangani konsumen. Harganya juga lumayan terjangkau",0,0,1,1,0,0,0,1
Rasanya biasa aja dan harga cenderung tinggi sih.,0,1,0,0,0,0,-1,1
Pelayanan yg super duper baik banget walaupun tempatnya kurang luas tapi tetap nyaman,0,0,1,1,0,1,0,0
"Chicken steaknya, oke tp ga yg enak bgt. Tapi untuk harganya murah banget kadang banyak diskon juga",0,1,0,0,0,0,1,1
"Makanannya cukup terbilang nikmat walau sedikit pedas. Pelayanannya ramah tapi kurang cekatan. Lokasi tempatnya agak jauh dari pusat kota, sehingga tidak menarik untuk dikunjungi.",0,1,0,1,-1,1,0,0
Harganya masuk akal. Kualitas rasa makanannya biasa saja. Suasana tempatnya membosankan dan sangat bising,0,1,0,0,-1,1,0,1
Lokasinya sangat bising dan tidak ideal untuk makan malam yang tenang. Harga makanannya tidak bersahabat,0,0,0,0,-1,1,-1,1
"Makanannya lumayan bisa dinikmati, tapi harganya sangat mahal untuk kualitas rasa yang seperti itu. Pelayanannya standar ",0,1,0,1,0,0,-1,1
Suasana tempatnya lumayan kurang pas untuk kumpul-kumpul keluarga. Pelayanannya cepat dan sangat responsif saat dipanggil.,0,0,1,1,0,1,0,0
"Harganya terjangkau, walau memang rasa makanannya biasa saja. Lokasi tempatnya kurang kondusif dan agak jauh dari transportasi umum.",0,1,0,0,0,1,1,1
"Stafnya ramah, tapi menunya terbatas, kurang bervariasi dan rasanya biasa aja. So far harganya masih bisa dijangkau si",0,1,1,1,0,0,0,1
